### ISSUE TITLE
Is the dummy server still working?

### ISSUE THREAD

**Issue by CPlusPlus17** [nyffchanium/argoclima-integration#40]
### System Health details

Does not work when using dummy server, else everything works fine.

### Checklist

- [x] I have enabled debug logging for my installation.
- [x] I have filled out the issue template to the best of my ability.
- [x] This issue only contains 1 issue (if you have multiple issues, open one issue for each issue).
- [x] This issue is not a duplicate issue of any [previous issues](https://github.com/nyffchanium/argoclima-integration/issues?q=is%3Aissue+label%3A%22Bug%22+)..

### Describe the issue

I'm tried to using the dummy server, NAT'ing works and tcpdumps shows traffic. But nothing is logged in the server, and opening http://10.0.0.192:1001/?HMI=N,N,N,N,N,N,N,N,N,N,N,N,N,N,N,N,N,N,N,N,N,N,N,N,N,N,N,N,N,N,N,N,N,N,N,N&UPD=0 does not work. As soon as I remove the NAT'ing everything works again.

Curl access from another client works to the server. So I'm not sure if there was an update that broke something?

### Reproduction steps

1.
2.
3.
...

### Debug logs

```text
tcpdump:

21:09:44.039342 IP 10.0.0.7.22122 > 10.0.0.192.47786: Flags [S.], seq 47803221, ack 8585, win 64240, options [mss 1460], length 0
E..,..@.@.&.
...
...Vj....kU..!.`...........
21:09:44.128815 IP 10.0.0.192.47786 > 10.0.0.7.22122: Flags [R.], seq 1, ack 1, win 2920, length 0
E..(.U@.....
...
.....Vj..!...kVP..h....
21:09:44.854278 IP 10.0.0.192.47786 > 10.0.0.7.22122: Flags [S], seq 8584, win 2920, options [mss 1460], length 0
E..,.V@.....
...
.....Vj..!.....`..hE[........
21:09:44.854322 IP 10.0.0.7.22122 > 10.0.0.192.47786: Flags [S.], seq 60537303, ack 8585, win 64240, options [mss 1460], length 0
E..,..@.@.&.
...
...Vj........!.`....N......
21:09:44.860543 IP 10.0.0.192.47786 > 10.0.0.7.22122: Flags [R.], seq 1, ack 1, win 2920, length 0
E..(.W@.....
...
.....Vj..!.....P..h....
21:09:45.878478 IP 10.0.0.192.47786 > 10.0.0.7.22122: Flags [S], seq 8584, win 2920, options [mss 1460], length 0
E..,.X@.....
...
.....Vj..!.....`..hE[........
21:09:45.878524 IP 10.0.0.7.22122 > 10.0.0.192.47786: Flags [S.], seq 76540423, ack 8585, win 64240, options [mss 1460], length 0
E..,..@.@.&.
...
...Vj........!.`...g*......
21:09:45.884103 IP 10.0.0.192.47786 > 10.0.0.7.22122: Flags [R.], seq 1, ack 1, win 2920, length 0
E..(.Y@.....
...
.....Vj..!.....P..hnl..
21:09:46.902616 IP 10.0.0.192.47786 > 10.0.0.7.22122: Flags [S], seq 8584, win 2920, options [mss 1460], length 0
E..,.Z@.....
...
.....Vj..!.....`..hE[........
21:09:46.902675 IP 10.0.0.7.22122 > 10.0.0.192.47786: Flags [S.], seq 92542808, ack 8585, win 64240, options [mss 1460], length 0
E..,..@.@.&.
...
...Vj.....X..!.`...8.......
21:09:46.994729 IP 10.0.0.192.47786 > 10.0.0.7.22122: Flags [R.], seq 1, ack 1, win 2920, length 0
E..(.[@.....
...
.....Vj..!....YP..h@'..


server:
go run main.go
Listening on port: 22122

when doing curl -v http://31.14.128.210:
go run main.go
Listening on port: 22122
INFO[0308] got request to /
INFO[0308] responding with: HTTP/1.1 200 OK
Content-Type: text/html
Server: Microsoft-IIS/8.5
X-Powered-By: PHP/5.4.11
Access-Control-Allow-Origin: *
Date: Mon, 18 Aug 2025 21:13:10 GMT\r\nContent-Length: 6

|}|}
```

**Comment by nyffchanium** [comment]
Hm, that's odd.

I've never had a problem like that. I'm seeing log entries every 10 seconds.

Are you on the same firmware version as I?
<img width="293" height="291" alt="Image" src="https://github.com/user-attachments/assets/a76657ef-e8fd-4c8c-82d3-cea5263ddb21" />

**Comment by CPlusPlus17** [comment]
Thanks for providing your versions, I have exactly the same.
It seems that OPNsense is doing some strange thing in the background. I'll do more analysis about this topic.

**Comment by CPlusPlus17** [comment]
Ok, very fast update, gemini 2.5 pro nailed it. 


This did not work, but is the base setup:

> ## Step 1: Create the NAT Port Forward Rule
> 
> This is the core rule that performs the redirection.
> 
> Navigate to Firewall > NAT > Port Forward in your OPNsense web interface.
> 
> Click the Add button (usually a '+' in the top right corner) to create a new rule.
> 
> Fill out the form with the following settings:
> 
> Interface: Select LAN. This is crucial because the rule needs to catch the traffic as it leaves your client on the LAN interface.
> 
> TCP/IP Version: IPv4
> 
> Protocol: Select the protocol your client uses (e.g., TCP, UDP, or TCP/UDP). If you're unsure, TCP/UDP is a safe choice.
> 
> Destination / Invert: Make sure this box is not checked.
> 
> Destination: Select Single host or alias and enter the hardcoded public IP: 31.14.128.210.
> 
> Destination port range: If the client connects to a specific port (like 80 for HTTP or 443 for HTTPS), enter it here. If it could be any port, you can select any. For a specific port, choose (Other) and enter the port number in both the "from" and "to" fields.
> 
> Redirect target IP: Select Single host or alias and enter the IP of your dummy server: 10.0.0.7.
> 
> Redirect target port: Enter the port your dummy server is listening on. This is often the same as the destination port.
> 
> Description: Add something descriptive, like Redirect hardcoded client to local dummy server.
> 
> NAT reflection: Set this to Enable. This is the key that makes the rule work for internal traffic.
> 
> Click Save.
> 
> A banner will appear at the top of the page. Click Apply changes.

Fix to get it working:

> ### Step 1: Disable NAT Reflection on Your Existing Rule
> 
> First, let's turn off the setting that's causing the problem.
> 
> Go back to your Port Forward rule at Firewall > NAT > Port Forward.
> 
> Edit the rule you created earlier.
> 
> Change the NAT reflection setting from Enable to Disable.
> 
> Click Save, and then Apply changes.
> 
> ### Step 2: Create the Outbound NAT Rule
> 
> This new rule will change the source of the packet to be the firewall itself, ensuring the server sends its reply back to the firewall.
> 
> Navigate to Firewall > NAT > Outbound.
> 
> Change the mode from Automatic to Hybrid outbound NAT rule generation. A new section for manual rules will appear. Click Save.
> 
> Click the Add button to create a new rule.
> 
> Fill out the form with the following settings:
> 
> Interface: Select LAN.
> 
> TCP/IP Version: IPv4
> 
> Protocol: any (or match the protocol from your port forward rule).
> 
> Source address: LAN net. This makes the rule apply to any device on your LAN.
> 
> Destination address: Single host or alias and enter the IP of your dummy server: 10.0.0.7. This is critical—the rule must only apply to traffic going to your internal server.
> 
> Translation / target: In the dropdown, select Interface Address. This will rewrite the source IP of the packet to be your OPNsense router's LAN IP.
> 
> Description: Give it a clear name, like SNAT for hardcoded IP redirect.
> 
> Click Save.
>
